number,question,answer1,answer2,answer3,rightAnswer
1,Хто з президентів США написав власну історію про Шерлока Холмса?,Джон Кеннеді,Франклін Рузвельт,Рональд Рейган,2
2,Який податок був введений в ХІІ столітті в Англії щоб змусити чоловіків йти на війну?,Податок на паразитизм,податок на боягузтво,податок на відсутність черевиків,2
3,Звідки походить вираз «гроші не пахнуть?»,Від претендентів на перевезення парфумів,від зборів за невипрані шкарпетки,від податку на туалети,3
4,Туристи які приїжджають на Майорку повинні платити податок на…?,Плавки,пальми,сонце,3
5,Хто із відомих художників продав за життя лише одну картину?,Вінсент Ван Гог,П'єр Огюст Ренуар,Едгар Дега,1